{
  "artifact": "tiingo_prestart_latency_evidence",
  "completed_at": "2026-10-07T00:00:01.730535Z",
  "credential_present": true,
  "credential_value_stored": false,
  "expected_session": "2026-10-06",
  "fixture_status": "PRE_START_NONOFFICIAL_SOURCE_EVIDENCE",
  "interruption_recorded": true,
  "observer_resumed_at": "2026-10-06T19:47:17.484032Z",
  "observer_started_at": "2026-10-05T19:59:30.886077Z",
  "official_observation_created": false,
  "performance_calculated": false,
  "polls": [
    {
      "classification": "SESSION_UNAVAILABLE_OR_INVALID",
      "content_type": "application/json",
      "http_status": 200,
      "poll": 1,
      "raw_bytes": 2,
      "raw_file": "poll_01_QQQ.raw",
      "raw_reconstruction": true,
      "raw_sha256": "4f53cda18c2baa0c0354bb5f9a3ecbe5ed12ab4d8e11ba873c2f11161202b945",
      "received_at": "2026-10-06T20:00:01.178564Z",
      "requested_at": "2026-10-06T20:00:00.001228Z",
      "row_count": 0,
      "scheduled_at": "2026-10-06T20:00:00Z",
      "symbol": "QQQ"
    },
    {
      "classification": "SESSION_UNAVAILABLE_OR_INVALID",
      "content_type": "application/json",
      "http_status": 200,
      "poll": 1,
      "raw_bytes": 2,
      "raw_file": "poll_01_QLD.raw",
      "raw_reconstruction": true,
      "raw_sha256": "4f53cda18c2baa0c0354bb5f9a3ecbe5ed12ab4d8e11ba873c2f11161202b945",
      "received_at": "2026-10-06T20:00:02.164335Z",
      "requested_at": "2026-10-06T20:00:01.181026Z",
      "row_count": 0,
      "scheduled_at": "2026-10-06T20:00:00Z",
      "symbol": "QLD"
    },
    {
      "classification": "VALID_SESSION",
      "content_type": "application/json",
      "http_status": 200,
      "poll": 2,
      "raw_bytes": 232,
      "raw_file": "poll_02_QQQ.raw",
      "raw_reconstruction": true,
      "raw_sha256": "b8177392f37aad45a540c41caa127c0127f24c50bba40e307a387769fc229c58",
      "received_at": "2026-10-06T21:30:01.151318Z",
      "requested_at": "2026-10-06T21:30:00.003534Z",
      "row_count": 1,
      "scheduled_at": "2026-10-06T21:30:00Z",
      "symbol": "QQQ"
    },
    {
      "classification": "VALID_SESSION",
      "content_type": "application/json",
      "http_status": 200,
      "poll": 2,
      "raw_bytes": 232,
      "raw_file": "poll_02_QLD.raw",
      "raw_reconstruction": true,
      "raw_sha256": "0b1f668aa6b521e74bd695657624f2b681d75c29834f2ea40cc278511b0fb078",
      "received_at": "2026-10-06T21:30:02.100283Z",
      "requested_at": "2026-10-06T21:30:01.152760Z",
      "row_count": 1,
      "scheduled_at": "2026-10-06T21:30:00Z",
      "symbol": "QLD"
    },
    {
      "classification": "VALID_SESSION",
      "content_type": "application/json",
      "http_status": 200,
      "poll": 3,
      "raw_bytes": 232,
      "raw_file": "poll_03_QQQ.raw",
      "raw_reconstruction": true,
      "raw_sha256": "b8177392f37aad45a540c41caa127c0127f24c50bba40e307a387769fc229c58",
      "received_at": "2026-10-06T22:00:00.975802Z",
      "requested_at": "2026-10-06T22:00:00.001254Z",
      "row_count": 1,
      "scheduled_at": "2026-10-06T22:00:00Z",
      "symbol": "QQQ"
    },
    {
      "classification": "VALID_SESSION",
      "content_type": "application/json",
      "http_status": 200,
      "poll": 3,
      "raw_bytes": 232,
      "raw_file": "poll_03_QLD.raw",
      "raw_reconstruction": true,
      "raw_sha256": "0b1f668aa6b521e74bd695657624f2b681d75c29834f2ea40cc278511b0fb078",
      "received_at": "2026-10-06T22:00:01.858865Z",
      "requested_at": "2026-10-06T22:00:00.976457Z",
      "row_count": 1,
      "scheduled_at": "2026-10-06T22:00:00Z",
      "symbol": "QLD"
    },
    {
      "classification": "VALID_SESSION",
      "content_type": "application/json",
      "http_status": 200,
      "poll": 4,
      "raw_bytes": 232,
      "raw_file": "poll_04_QQQ.raw",
      "raw_reconstruction": true,
      "raw_sha256": "b8177392f37aad45a540c41caa127c0127f24c50bba40e307a387769fc229c58",
      "received_at": "2026-10-06T23:00:01.545862Z",
      "requested_at": "2026-10-06T23:00:00.013757Z",
      "row_count": 1,
      "scheduled_at": "2026-10-06T23:00:00Z",
      "symbol": "QQQ"
    },
    {
      "classification": "VALID_SESSION",
      "content_type": "application/json",
      "http_status": 200,
      "poll": 4,
      "raw_bytes": 232,
      "raw_file": "poll_04_QLD.raw",
      "raw_reconstruction": true,
      "raw_sha256": "0b1f668aa6b521e74bd695657624f2b681d75c29834f2ea40cc278511b0fb078",
      "received_at": "2026-10-06T23:00:02.806990Z",
      "requested_at": "2026-10-06T23:00:01.550261Z",
      "row_count": 1,
      "scheduled_at": "2026-10-06T23:00:00Z",
      "symbol": "QLD"
    },
    {
      "classification": "VALID_SESSION",
      "content_type": "application/json",
      "http_status": 200,
      "poll": 5,
      "raw_bytes": 232,
      "raw_file": "poll_05_QQQ.raw",
      "raw_reconstruction": true,
      "raw_sha256": "b8177392f37aad45a540c41caa127c0127f24c50bba40e307a387769fc229c58",
      "received_at": "2026-10-07T00:00:00.928985Z",
      "requested_at": "2026-10-07T00:00:00.004489Z",
      "row_count": 1,
      "scheduled_at": "2026-10-07T00:00:00Z",
      "symbol": "QQQ"
    },
    {
      "classification": "VALID_SESSION",
      "content_type": "application/json",
      "http_status": 200,
      "poll": 5,
      "raw_bytes": 232,
      "raw_file": "poll_05_QLD.raw",
      "raw_reconstruction": true,
      "raw_sha256": "0b1f668aa6b521e74bd695657624f2b681d75c29834f2ea40cc278511b0fb078",
      "received_at": "2026-10-07T00:00:01.729931Z",
      "requested_at": "2026-10-07T00:00:00.930514Z",
      "row_count": 1,
      "scheduled_at": "2026-10-07T00:00:00Z",
      "symbol": "QLD"
    }
  ],
  "raw_archive_outside_repository": true,
  "schedule_utc": [
    "2026-10-06T20:00:00Z",
    "2026-10-06T21:30:00Z",
    "2026-10-06T22:00:00Z",
    "2026-10-06T23:00:00Z",
    "2026-10-07T00:00:00Z"
  ],
  "session_open_at": "2026-10-06T13:30:00Z",
  "source_promoted": false,
  "status": "OBSERVATION_COMPLETE",
  "symbols": [
    "QQQ",
    "QLD"
  ]
}
